{
  "slug": "insights",
  "name": "insights",
  "title": "Frappe Insights",
  "description": "Open source business intelligence and data analytics tool for Frappe, with a drag-and-drop query builder, charts, and dashboards.",
  "repository": "https://github.com/frappe/insights",
  "license": "AGPL-3.0",
  "frappe_versions": ["14", "15", "16"],
  "required_apps": ["frappe"],
  "categories": ["Reports"],
  "tags": ["analytics", "bi", "charts", "dashboard", "data", "reports"],
  "install": {
    "method": "bench",
    "command": "bench get-app insights",
    "app_name": "insights"
  },
  "links": {
    "docs": "https://docs.frappe.io/insights",
    "demo": "https://insights.frappe.io",
    "website": "https://frappe.io/insights"
  },
  "media": {
    "icon": "https://raw.githubusercontent.com/frappe/insights/develop/insights/public/images/insights-logo.png",
    "screenshots": []
  },
  "meta": {
    "source": "manual",
    "verified": true,
    "status": "active",
    "added_at": "2026-06-09"
  }
}
