{
  "slug": "hrms",
  "name": "hrms",
  "title": "Frappe HR",
  "description": "Modern HR and payroll management system for Frappe, with leave management, expense claims, shift scheduling, and full payroll processing.",
  "repository": "https://github.com/frappe/hrms",
  "license": "GPL-3.0",
  "frappe_versions": ["14", "15", "16"],
  "required_apps": ["frappe", "erpnext"],
  "categories": ["HR"],
  "tags": ["hr", "payroll", "leave", "attendance", "expense", "shift"],
  "install": {
    "method": "bench",
    "command": "bench get-app hrms",
    "app_name": "hrms"
  },
  "links": {
    "docs": "https://docs.frappe.io/hrms",
    "website": "https://frappe.io/hr"
  },
  "media": {
    "icon": "https://raw.githubusercontent.com/frappe/hrms/develop/hrms/public/images/hrms-logo.png",
    "screenshots": []
  },
  "meta": {
    "source": "manual",
    "verified": true,
    "status": "active",
    "added_at": "2026-06-09"
  }
}
