{
  "slug": "wiki",
  "name": "wiki",
  "title": "Frappe Wiki",
  "description": "A collaborative wiki and knowledge base app for Frappe, with rich text editing, versioning, and hierarchical organization of content.",
  "repository": "https://github.com/frappe/wiki",
  "license": "AGPL-3.0",
  "frappe_versions": ["14", "15", "16"],
  "required_apps": ["frappe"],
  "categories": ["Utilities"],
  "tags": ["wiki", "docs", "knowledge-base", "collaboration"],
  "install": {
    "method": "bench",
    "command": "bench get-app wiki",
    "app_name": "wiki"
  },
  "links": {
    "docs": "https://github.com/frappe/wiki#readme",
    "website": "https://frappe.io"
  },
  "media": {
    "icon": "",
    "screenshots": []
  },
  "meta": {
    "source": "manual",
    "verified": true,
    "status": "active",
    "added_at": "2026-06-09"
  }
}
