{
  "slug": "helpdesk",
  "name": "helpdesk",
  "title": "Frappe Helpdesk",
  "description": "Modern, open source customer support and ticketing system built on Frappe, with SLA management, canned responses, and an agent portal.",
  "repository": "https://github.com/frappe/helpdesk",
  "license": "AGPL-3.0",
  "frappe_versions": ["14", "15", "16"],
  "required_apps": ["frappe"],
  "categories": ["Utilities", "CRM"],
  "tags": ["helpdesk", "support", "tickets", "sla", "customer-service"],
  "install": {
    "method": "bench",
    "command": "bench get-app helpdesk",
    "app_name": "helpdesk"
  },
  "links": {
    "docs": "https://docs.frappe.io/helpdesk",
    "demo": "https://helpdesk.frappe.io",
    "website": "https://frappe.io/helpdesk"
  },
  "media": {
    "icon": "https://raw.githubusercontent.com/frappe/helpdesk/develop/helpdesk/public/images/helpdesk-logo.png",
    "screenshots": []
  },
  "meta": {
    "source": "manual",
    "verified": true,
    "status": "active",
    "added_at": "2026-06-09"
  }
}
