{
  "slug": "example-app",
  "name": "example_app",
  "title": "Example App",
  "description": "This is an example app to demonstrate the registry JSON format. Do not submit this file — copy it, rename it, and fill in your own details.",
  "repository": "https://github.com/your-org/your-app",
  "license": "MIT",
  "frappe_versions": ["15", "16"],
  "required_apps": ["frappe"],
  "categories": ["Utilities"],
  "tags": ["example", "template"],
  "install": {
    "method": "bench",
    "command": "bench get-app https://github.com/your-org/your-app",
    "app_name": "example_app"
  },
  "links": {
    "docs": "https://github.com/your-org/your-app#readme",
    "demo": "https://demo.your-app.com",
    "website": "https://your-app.com"
  },
  "media": {
    "icon": "https://your-app.com/icon.png",
    "screenshots": [
      "https://your-app.com/screenshots/screen1.png"
    ]
  },
  "meta": {
    "source": "manual",
    "verified": false,
    "status": "active",
    "added_at": "2026-06-09"
  }
}
