{
  "slug": "erpnext",
  "name": "erpnext",
  "title": "ERPNext",
  "description": "Free and open source ERP system built on Frappe Framework, covering accounting, inventory, manufacturing, CRM, HR, and more.",
  "repository": "https://github.com/frappe/erpnext",
  "license": "GPL-3.0",
  "frappe_versions": ["14", "15", "16"],
  "required_apps": ["frappe"],
  "categories": ["Accounting", "Manufacturing", "HR", "CRM"],
  "tags": ["erp", "accounting", "inventory", "manufacturing", "crm", "hr", "payroll"],
  "install": {
    "method": "bench",
    "command": "bench get-app erpnext",
    "app_name": "erpnext"
  },
  "links": {
    "docs": "https://docs.erpnext.com",
    "demo": "https://demo.erpnext.com",
    "website": "https://erpnext.com"
  },
  "media": {
    "icon": "https://raw.githubusercontent.com/frappe/erpnext/develop/erpnext/public/images/erpnext-logo.png",
    "screenshots": [
      "https://erpnext.com/files/erpnext-home.png"
    ]
  },
  "meta": {
    "source": "manual",
    "verified": true,
    "status": "active",
    "added_at": "2026-06-09"
  }
}
